{
  "$schema": "https://json-schema.org/draft/2020-12/schema",
  "$id": "https://github.com/Codevider/kubedok-deploy/releases/release.schema.json",
  "title": "Kubedok release manifest",
  "description": "Immutable description of one Kubedok suite release. Published by CI only after every image in `images` has been pushed successfully.",
  "type": "object",
  "additionalProperties": false,
  "required": [
    "schemaVersion",
    "release",
    "publishedAt",
    "images",
    "builtFrom",
    "agentVersion",
    "postgresMajor",
    "minimumAgentVersion",
    "minimumUpgradeFrom"
  ],
  "properties": {
    "schemaVersion": {
      "description": "Version of this manifest format. setup.sh/update.sh refuse manifests they do not understand.",
      "type": "integer",
      "const": 1
    },
    "release": {
      "description": "Release version: names this set of four images. The server, nginx and PostgreSQL images are tagged with the release that built them; the agent has a version of its own (agentVersion).",
      "type": "string",
      "pattern": "^[0-9]+\\.[0-9]+\\.[0-9]+$"
    },
    "publishedAt": {
      "description": "UTC timestamp the manifest was published.",
      "type": "string",
      "format": "date-time"
    },
    "gitRevision": {
      "description": "Commit the release was assembled from. Each image's own source commit is in builtFrom.",
      "type": "string",
      "pattern": "^[0-9a-f]{40}$"
    },
    "images": {
      "description": "Immutable digest references. Never tags — a tag can be repointed, a digest cannot.",
      "type": "object",
      "additionalProperties": false,
      "required": ["server", "nginx", "postgres", "agent"],
      "properties": {
        "server": { "$ref": "#/$defs/digestRef" },
        "nginx": { "$ref": "#/$defs/digestRef" },
        "postgres": { "$ref": "#/$defs/digestRef" },
        "agent": { "$ref": "#/$defs/digestRef" }
      }
    },
    "builtFrom": {
      "description": "The commit each image was built from. An image a release kept from the one before keeps that commit too, which is what release.sh measures changes against.",
      "type": "object",
      "additionalProperties": false,
      "required": ["server", "nginx", "postgres", "agent"],
      "properties": {
        "server": { "$ref": "#/$defs/commit" },
        "nginx": { "$ref": "#/$defs/commit" },
        "postgres": { "$ref": "#/$defs/commit" },
        "agent": { "$ref": "#/$defs/commit" }
      }
    },
    "agentVersion": {
      "description": "Version of the agent image this release ships: the agent's own, apart from the release's. A release that did not change the agent keeps the previous one and its version.",
      "type": "string",
      "pattern": "^[0-9]+\\.[0-9]+\\.[0-9]+$"
    },
    "postgresMajor": {
      "description": "PostgreSQL major version this release expects. A change here is a major-version upgrade and is never performed by update.sh.",
      "type": "integer",
      "minimum": 13
    },
    "minimumAgentVersion": {
      "description": "Oldest agent version this server release still speaks to. Agents below this must be updated with agent-update.sh.",
      "type": "string",
      "pattern": "^[0-9]+\\.[0-9]+\\.[0-9]+$"
    },
    "minimumUpgradeFrom": {
      "description": "Oldest installed release that may update directly to this one. Older installs must step through an intermediate release.",
      "type": "string",
      "pattern": "^[0-9]+\\.[0-9]+\\.[0-9]+$"
    },
    "notes": {
      "description": "Human-readable release notes URL or short summary.",
      "type": "string"
    }
  },
  "$defs": {
    "digestRef": {
      "type": "string",
      "pattern": "^[a-z0-9][a-z0-9._/-]*@sha256:[0-9a-f]{64}$"
    },
    "commit": {
      "type": "string",
      "pattern": "^[0-9a-f]{40}$"
    }
  }
}
